{
    "startTime": 0.0,
    "endTime": 2.0,
    "deltaT": 0.001,
    "adjustTimeStep": true,
    "maxCo": 2.5,
    "maxDeltaT": 1e-06,
    "nOuterCorrectors": null,
    "nInnerIterations": null,
    "writeControl": "timeStep",
    "writeInterval": 1.0,
    "writeFormat": "ascii",
    "writePrecision": 10,
    "writeCompression": false
}